id,name,sender_character_id,receiver_character_ids,plot_ids,event_ids,type,after_jump,locked,sent,message,gm_notes
73,The future depends on you fellow scientists,Kara Bennett,"Remy Hall, Terran Wells, Blake Ishimoto, Devyn Pearson, Evin Reid",,,Text NPC,4,TRUE,Not yet,"Hello everyone!
I’m sending this message to everyone I know, in hopes that at least one of you might answer. I’m alive (obviously) and well, currently onboard ESS Memory, which is a civilian corvette and currently carries 107 passengers.
Enough chit-chat, let’s get to business. The fate of the entire human race quite literally depends on us now, on how we are able to respond to this enormous challenge. Frustratingly, there is not much I can do from where I am at the moment, but you might be in a better position to do something, and I might in turn be able to help you. Especially looking at you, Remy et al. onboard ESS Odysseus. I hope you lot made it out.
If you are alive, please send a reply as soon as you receive this message. If you are dead, you obviously don’t have to reply, but you can if you want to and manage to find a way. If you are alive and don’t reply, that’s on you, but know that I think that’s just plain rude, considering the circumstances.
Regards,
Doctor Kara BennettLead ScientistElder Outpost research project",
74,Pax Houghton is your father,Evelyn Case,Ballard Case,,81,Text NPC,9,TRUE,Not yet,Placeholder text for telling Ballard that it was Pax Houghton who is their real father and telling that Evelyn just couldn't stand Pax's criminal life. Evelyn still thinks that she did the right thing but is sorry that Ballard grew up without father. ,Send this before Karma is blamed to be Gray Scorpio vessel